{
  "id": "urn:gaam:example:independent-assurance-assessment:governance-event",
  "type": "governance-event",
  "artifact": "urn:gaam:example:delegated-agent-purchase:authority",
  "eventType": "suspended",
  "priorState": "active",
  "newState": "suspended",
  "authority": "urn:gaam:authority:governing",
  "evidence": [
    "urn:gaam:evidence:delegated-agent-purchase:suspension"
  ],
  "eventTime": "2026-07-29T12:00:00Z"
}
